{"schema_version":1,"experiment_id":"multi-market-depth-callback-panic","target_strategy_id":"strategy-0","spec_fingerprint":"a8669f4f2e295754","total_candidates":2,"completed_candidates":2,"succeeded_candidates":1,"failed_candidates":1,"candidates":[{"ordinal":1,"parameters":{"mode":1},"outcome":null,"error":"{\"action\":\"REPORT_BUG\",\"category\":\"INTERNAL_INVARIANT\",\"correlation_id\":\"multi-market-depth-callback-panic-0001\",\"message\":\"用例边界捕获到 panic: intentional candidate factory panic\",\"retry\":\"NEVER\",\"safe_to_retry\":false,\"source_code\":\"panic\"}"},{"ordinal":2,"parameters":{"mode":2},"outcome":{"run_id":"multi-market-depth-callback-panic-0002","account_id":"shared-account","spec_fingerprint":"e7e5f16537cb4ff5","data_fingerprint":"ca1df177d8420353","shared_result_hash":"748317e05e701f71","markets_total":2,"successful_fills":1,"pending_orders":0,"equity_points":2,"final_equity_raw":100000000000,"return_bps":0,"max_drawdown_bps":0,"artifact_path":"D:\\aex_work\\qianxing\\crates\\qx-cli\\.task-tmp\\qx-app-tests/multi-market-depth-experiment-callback-panic-30480-0\\out\\multi-market-depth-callback-panic\\run-0002\\multi-market-depth-callback-panic-0002.multi-market-depth.json"},"error":null}],"ranking":[{"rank":1,"ordinal":2,"run_id":"multi-market-depth-callback-panic-0002","return_bps":0,"max_drawdown_bps":0,"shared_result_hash":"748317e05e701f71"}],"artifact_path":"D:\\aex_work\\qianxing\\crates\\qx-cli\\.task-tmp\\qx-app-tests/multi-market-depth-experiment-callback-panic-30480-0\\out\\multi-market-depth-callback-panic\\multi-market-depth-callback-panic.multi-market-depth-experiment.json"}