{"schema_version":1,"experiment_id":"multi-market-grid","target_strategy_id":"slot-0","spec_fingerprint":"6bbf74731a70024b","total_candidates":4,"completed_candidates":4,"succeeded_candidates":4,"failed_candidates":0,"candidates":[{"ordinal":1,"strategy_kind":"ema_cross","parameters":{"fast_window":2},"outcome":{"run_id":"multi-market-grid-0001","account_id":"grid-account","spec_fingerprint":"150986539b92d8df","data_fingerprint":"9a9c4838abc9bb15","shared_result_hash":"caca25d4398d566b","markets_total":3,"strategies_total":3,"successful_fills":21,"equity_points":240,"final_equity_raw":100177849000000,"return_bps":17,"max_drawdown_bps":1,"artifact_path":"D:\\aex_work\\qianxing\\crates\\qx-cli\\.task-tmp\\qx-app-tests/multi-market-experiment-11884-62\\output\\multi-market-grid\\run-0001\\multi-market-grid-0001.multi-market.json"},"error":null},{"ordinal":2,"strategy_kind":"ema_cross","parameters":{"fast_window":3},"outcome":{"run_id":"multi-market-grid-0002","account_id":"grid-account","spec_fingerprint":"c95e6cee55debd8a","data_fingerprint":"9a9c4838abc9bb15","shared_result_hash":"07cacb0e1726b733","markets_total":3,"strategies_total":3,"successful_fills":21,"equity_points":240,"final_equity_raw":100151850000000,"return_bps":15,"max_drawdown_bps":2,"artifact_path":"D:\\aex_work\\qianxing\\crates\\qx-cli\\.task-tmp\\qx-app-tests/multi-market-experiment-11884-62\\output\\multi-market-grid\\run-0002\\multi-market-grid-0002.multi-market.json"},"error":null},{"ordinal":3,"strategy_kind":"sma_cross","parameters":{"fast_window":2},"outcome":{"run_id":"multi-market-grid-0003","account_id":"grid-account","spec_fingerprint":"134ab8ee9ca3374d","data_fingerprint":"9a9c4838abc9bb15","shared_result_hash":"9f232b591a1a9e1d","markets_total":3,"strategies_total":3,"successful_fills":21,"equity_points":240,"final_equity_raw":100177849000000,"return_bps":17,"max_drawdown_bps":1,"artifact_path":"D:\\aex_work\\qianxing\\crates\\qx-cli\\.task-tmp\\qx-app-tests/multi-market-experiment-11884-62\\output\\multi-market-grid\\run-0003\\multi-market-grid-0003.multi-market.json"},"error":null},{"ordinal":4,"strategy_kind":"sma_cross","parameters":{"fast_window":3},"outcome":{"run_id":"multi-market-grid-0004","account_id":"grid-account","spec_fingerprint":"e820fab8de283fa0","data_fingerprint":"9a9c4838abc9bb15","shared_result_hash":"5ef415a0d16a370d","markets_total":3,"strategies_total":3,"successful_fills":21,"equity_points":240,"final_equity_raw":100151850000000,"return_bps":15,"max_drawdown_bps":2,"artifact_path":"D:\\aex_work\\qianxing\\crates\\qx-cli\\.task-tmp\\qx-app-tests/multi-market-experiment-11884-62\\output\\multi-market-grid\\run-0004\\multi-market-grid-0004.multi-market.json"},"error":null}],"ranking":[{"rank":1,"ordinal":1,"run_id":"multi-market-grid-0001","return_bps":17,"max_drawdown_bps":1,"shared_result_hash":"caca25d4398d566b"},{"rank":2,"ordinal":3,"run_id":"multi-market-grid-0003","return_bps":17,"max_drawdown_bps":1,"shared_result_hash":"9f232b591a1a9e1d"},{"rank":3,"ordinal":2,"run_id":"multi-market-grid-0002","return_bps":15,"max_drawdown_bps":2,"shared_result_hash":"07cacb0e1726b733"},{"rank":4,"ordinal":4,"run_id":"multi-market-grid-0004","return_bps":15,"max_drawdown_bps":2,"shared_result_hash":"5ef415a0d16a370d"}],"artifact_path":"D:\\aex_work\\qianxing\\crates\\qx-cli\\.task-tmp\\qx-app-tests/multi-market-experiment-11884-62\\output\\multi-market-grid\\multi-market-grid.multi-market-experiment.json"}